,name,age,position1,position2,Apps,Mins,Tackles,Inter,Fouls,Offsides,Clear,Drb,Blocks,OwnG,Rating
307,Elmir Nabiullin PFC Sochi,26, D(L),M(L),13(7),1240,1.3,1,1,0.2,1.7,0.7,0.1,-,6.47
308,Maksim Nenakhov FK Akhmat,22, D(R),,9,810,1.8,1.6,0.9,0.3,2.7,0.9,0.3,-,6.47
309,Denis Makarov Rubin Kazan,23, AM(R),,5(4),422,1.1,0.3,0.8,-,0.7,0.7,0.1,-,6.47
310,Anton Shvets FK Akhmat,28, D(C),DMC,15(4),1386,1.6,0.7,1.3,0.3,1.5,0.7,0.5,-,6.47
311,Igor Yurganov PFC Sochi,27, D(C),,6(3),552,0.8,1.9,0.8,0.8,3.4,0.4,0.9,-,6.46
312,Ramil Sheydayev Dinamo Moscow,25, FW,,5(3),502,1.0,0.3,0.5,-,1.3,0.9,0.1,-,6.46
313,Aleksandr Kolomeytsev Lokomotiv Moscow,32, M(CL),FW,5(5),495,1.7,0.3,0.8,-,0.8,1.1,-,-,6.46
314,Mikhail Sivakov FC Orenburg,33, D(C),,18(2),1558,0.7,1.0,0.8,0.4,4.9,0.9,0.9,-,6.46
315,Konstantin Maradishvili CSKA Moscow,21, DMC,,7(4),557,1.6,0.5,1.8,-,0.2,0.3,-,-,6.45
316,Oleksandr Kaplienko FC Tambov,25, D(CL),,4(5),489,1.2,0.9,0.6,-,1.0,0.6,0.1,-,6.45
317,Evans Kangwa Arsenal Tula,29, AM(CLR),FW,14(8),1139,1.0,0.1,0.8,-,0.3,0.3,-,-,6.45
318,Igor Kalinin Ural,26, D(L),,6,529,0.5,2.0,0.7,-,1.5,0.7,0.3,-,6.44
319,Pavel Maslov Spartak Moscow,21, D(C),,9,791,1.4,1.4,1.4,0.1,1.6,0.9,0.4,1,6.44
320,Ivan Ignatjev FC Krasnodar,22, FW,,5(8),530,0.2,0.2,1.1,-,0.3,0.3,0.1,-,6.43
321,Andrey Egorychev Ural,28, M(CLR),,17(9),1575,1.2,0.9,1.1,-,0.4,0.5,0.2,-,6.43
322,Evgeni Shlyakov FC Tambov,30, D(L),M(L),5(2),380,0.9,0.6,0.3,0.3,1.3,0.3,-,-,6.42
323,Maciej Wilusz Ural,33, D(C),,8,676,0.6,2.1,0.1,0.9,3.3,-,0.9,-,6.42
324,Andrey Bokovoy PFC Sochi,21, Midfielder,,0(2),43,1.0,-,1.5,-,-,1.5,-,-,6.42
325,Daniil Shamkin Zenit,19, Forward,,1(3),92,2.0,0.3,1.0,-,0.3,0.3,-,-,6.41
326,Leon Musaev Zenit,22, DMC,,3(6),311,1.1,0.4,1.0,-,0.6,0.2,0.3,-,6.41
327,Danil Glebov FC Rostov,22, M(C),,13(6),1105,1.3,0.9,1.2,-,0.5,0.7,0.1,-,6.41
328,Emiliano Rigoni Zenit,28, M(CLR),FW,6(6),407,0.4,0.3,0.8,-,-,0.3,0.1,-,6.41
329,Takuma Nishimura CSKA Moscow,25, FW,,1(4),224,0.8,-,1.6,-,0.4,0.2,-,-,6.41
330,Darko Jevtic Rubin Kazan,28, M(C),,8(2),585,0.6,0.1,0.8,0.1,0.3,1.1,-,-,6.41
331,Björn Sigurdarson FC Rostov,30, AM(C),FW,1(5),149,0.3,-,0.8,-,-,-,-,-,6.41
332,Ziga Skoflek FC Orenburg,27, AM(R),,7(4),607,0.5,0.5,0.6,-,0.4,0.5,-,-,6.41
333,Dejan Radonjic Krylya Sovetov Samara,31, FW,,8(19),942,0.1,0.1,1,-,0.3,0.2,0.1,-,6.4
334,Vladislav Karapuzov Dinamo Moscow,21, M(R),,2(3),250,0.8,0.2,0.6,-,0.2,0.2,-,-,6.4
335,Akmal Bakhtiyarov PFC Sochi,23, Midfielder,,0(2),27,2.0,-,1,-,-,-,-,-,6.4
336,Sergey Kochkanyan FC Rostov,18, Defender,,0(1),45,2.0,2,-,-,3,-,-,-,6.4
337,Valeri Gromyko Arsenal Tula,24, Midfielder,,0(3),35,0.3,-,0.3,-,-,-,-,-,6.4
338,Roman Tugarev Lokomotiv Moscow,23, AM(R),,1(4),143,0.8,0.4,0.4,-,-,0.8,-,-,6.4
339,Abdul-Aziz Tetteh Dinamo Moscow,31, DMC,,1(2),141,0.3,1,-,-,2.3,-,-,-,6.4
340,Rizvan Utsiev FK Akhmat,33, D(R),M(R),14,1177,1.3,1.2,1.8,0.1,1.6,0.5,0.4,-,6.39
341,Zaurbek Pliev Dinamo Moscow,30, D(CL),M(L),10(4),876,1.6,1.5,1.4,0.2,1.2,0.4,0.4,-,6.39
342,Solomon Kvirkvelia Lokomotiv Moscow,29, D(C),,5(4),476,0.4,1.2,0.4,0.6,3.1,0.1,0.4,-,6.39
343,Mohamed Konate FC Tambov,23, FW,,1(1),88,-,-,1.0,-,-,-,-,-,6.39
344,Islambek Kuat FC Orenburg,28, DMC,,3,219,0.7,1,2.3,-,1,1,0.7,-,6.38
345,Danila Emelyanov FC Ufa,21, Midfielder,,7(5),612,1.2,0.4,0.6,-,0.4,0.6,0.3,-,6.38
346,Alexander Anyukov Krylya Sovetov Samara,39, D(CLR),,18,1484,0.8,1,0.7,0.1,2.2,0.2,0.3,-,6.38
347,Andrey Kozlov FC Ufa,32, FW,,9(7),761,0.3,0.1,1.4,-,0.3,0.3,-,-,6.37
348,Ivan Ignatjev Rubin Kazan,22, FW,,11,861,0.1,-,1.4,-,0.2,0.1,0.1,-,6.37
349,Artem Golubev FC Ufa,22, M(C),,9(10),944,0.5,0.7,0.9,0.1,0.7,0.2,0.2,-,6.37
350,Aleksey Pomerko PFC Sochi,31, DMC,,8(2),642,0.2,0.4,1.3,-,1.7,0.5,0.5,-,6.36
351,Aleksey Chernov FC Ufa,23, GK,,4,360,-,-,-,-,-,-,-,-,6.36
352,Aleksandr Saplinov FC Rostov,24, M(C),,6(15),749,0.9,0.5,0.7,-,0.5,0.7,-,-,6.36
353,Daniil Kulikov Lokomotiv Moscow,23, DMC,,3(3),275,2,0.8,1.5,-,0.5,0.3,-,-,6.36
354,Evgeni Pesegov PFC Sochi,32, DMC,,4,304,1.3,0.3,1.5,-,0.8,1.3,0.3,-,6.35
355,Ravanelli FK Akhmat,24, AM(CLR),,3(2),214,0.2,-,0.8,-,0.2,0.8,-,-,6.35
356,Evgeny Bashkirov Rubin Kazan,30, DMC,,8(3),655,1,1.1,1.1,-,0.5,0.7,0.1,-,6.34
357,Aleksandr Zuev FC Rostov,25, D(LR),M(CLR),1(6),184,0.6,0.1,1.3,-,0.3,-,-,-,6.34
358,Evgeni Markov Rubin Kazan,27, FW,,9(13),842,0.2,0.1,1,-,0.4,0.2,0.1,-,6.34
359,Radu Gînsari Krylya Sovetov Samara,29, AM(C),,7(3),586,0.9,0.4,0.9,-,0.6,0.5,0.3,-,6.34
360,Dmitri Rybchinskiy Lokomotiv Moscow,23, D(R),M(LR),2(5),229,0.4,-,0.7,-,0.1,0.4,-,-,6.34
361,Denis Terentjev FC Ufa,29, D(LR),,3(7),317,0.6,0.6,0.5,-,0.3,-,-,-,6.34
362,Clinton N'Jie Dinamo Moscow,28, AM(LR),FW,7(12),776,0.3,0.1,1.1,-,0.1,0.2,-,-,6.34
363,Jaka Bijol CSKA Moscow,22, D(C),M(C),4(21),622,0.3,0.4,1,-,0.2,0.1,0.1,-,6.34
364,Brian Idowu Lokomotiv Moscow,29, D(CLR),M(LR),5(7),474,0.8,0.6,0.7,0.1,0.6,0.3,0.1,-,6.33
365,Róbert Mak Zenit,30, M(LR),FW,0(5),54,-,-,-,-,-,0.4,-,-,6.33
366,Dmitri Efremov Ural,26, M(LR),,2(6),293,1.4,0.4,0.1,-,-,0.8,-,-,6.33
367,Lucas Santos CSKA Moscow,22, Midfielder,,0(2),56,-,-,-,-,-,-,-,-,6.32
368,Vyacheslav Grulev Dinamo Moscow,22, AM(L),FW,4(9),408,0.2,0.1,0.5,0.1,0.2,0.2,0.1,-,6.32
369,Artem Kulishev FC Orenburg,28, Midfielder,,10(8),977,0.8,0.1,0.8,-,0.4,0.4,0.1,-,6.32
370,Lovro Bizjak FC Ufa,28, FW,,14(11),1417,0.6,0.3,1.8,-,0.5,0.2,0.1,-,6.32
371,Alan Dzagoev CSKA Moscow,31, M(CLR),FW,6(4),487,0.6,0.3,1.1,-,-,0.8,-,-,6.32
372,Vladislav Poletaev Ural,21, Goalkeeper,,1,90,-,-,-,-,-,-,-,-,6.32
373,Mikhail Gaschenkov FK Akhmat,29, DMC,,3(3),288,0.8,0.7,0.2,-,1.5,0.5,0.3,-,6.32
374,Beka Mikeltadze Rubin Kazan,23, Forward,,3(8),417,0.8,0.3,1.1,-,0.5,-,-,-,6.31
375,Andrea Chukanov FC Orenburg,25, Forward,,9(8),865,0.8,0.6,0.5,-,0.7,0.4,0.1,-,6.31
376,Vladislav Kulik FC Tambov,36, M(CL),,2(3),118,0.6,-,0.4,-,0.8,0.8,-,-,6.31
377,Fedor Chernykh FC Orenburg,30, AM(CLR),FW,5(6),447,-,0.5,0.8,0.1,0.5,0.2,0.1,-,6.31
378,Oscar Hiljemark Dinamo Moscow,29, M(C),,5(9),660,0.5,0.4,0.1,-,0.4,0.4,0.2,-,6.31
379,Damian Szymanski FK Akhmat,26, M(C),,2(2),179,1.5,0.3,1.5,-,0.8,-,0.3,-,6.3
380,Andrei Panyukov Ural,27, FW,,15(9),1211,0.2,0.1,0.8,-,0.1,0.3,-,-,6.3
381,Anton Sosnin Dinamo Moscow,31, D(LR),M(CL),1(3),135,0.5,1.5,0.5,0.5,1,0.5,0.3,-,6.3
382,Aleksandr Chernikov FC Krasnodar,21, DMC,,3(3),186,1,0.3,1.3,-,0.5,0.2,-,-,6.29
383,Luka Djordjevic Lokomotiv Moscow,27, FW,,1(3),81,-,-,0.5,-,0.5,0.3,0.3,-,6.29
384,Nikolay Giorgobiani FC Ufa,24, Midfielder,,5(9),437,0.1,0.2,1,-,0.2,0.1,0.1,-,6.29
385,Matías Kranevitter Zenit,28, DMC,,0(2),28,-,0.5,-,-,-,-,-,-,6.29
386,Alexandru Tudorie Arsenal Tula,25, Forward,,2(5),202,0.1,-,0.6,-,0.7,-,-,-,6.28
387,Jano Ananidze Spartak Moscow,29, AM(CLR),,4(2),326,0.7,-,0.3,-,0.2,0.8,-,-,6.28
388,Olabiran Blessing Muyiwa FC Tambov,23, Midfielder,,0(8),278,0.5,0.5,1.5,-,0.1,0.4,-,-,6.28
389,Khyzyr Appaev FC Tambov,31, FW,,7(6),713,0.5,-,1.3,-,0.5,0.3,-,-,6.28
390,Dmitriy Tarasov Rubin Kazan,34, DMC,,0(4),67,0.5,1,0.8,-,0.8,0.8,-,-,6.27
391,Miguel Cardoso FC Tambov,27, AM(CLR),FW,0(1),5,-,-,-,-,-,-,-,-,6.27
392,Pavel Pogrebnyak Ural,38, FW,,6(10),609,0.1,-,1,-,0.3,-,-,-,6.27
393,Felipe Vizeu FK Akhmat,24, FW,,3(4),328,0.3,-,0.6,-,0.3,0.3,-,-,6.26
394,Aleksander Vasyutin Zenit,26, GK,,2,180,-,-,-,-,0.5,-,-,-,6.26
395,Vidar Örn Kjartansson Rubin Kazan,31, FW,,10(6),965,0.1,0.2,1.1,-,0.5,-,-,-,6.25
396,Danil Lipovoy FC Orenburg,22, M(R),,4(1),372,0.8,-,1.2,-,0.2,0.6,-,-,6.25
397,George Melkadze Spartak Moscow,24, AM(CL),FW,0(2),34,-,1,1,-,-,0.5,-,-,6.25
398,Arseni Logashov FC Rostov,30, D(CR),M(R),2(8),311,0.9,0.4,0.4,-,1.2,0.3,0.2,-,6.24
399,Yan Kazaev PFC Sochi,29, DMC,,3(1),269,0.8,-,0.8,-,-,0.5,-,-,6.24
400,Ablaye Mbengue FK Akhmat,29, FW,,5(11),589,0.3,0.1,0.6,-,0.3,0.1,0.1,-,6.24
401,Konrad Michalak FK Akhmat,24, AM(LR),,2(4),230,0.7,0.5,0.3,-,-,0.3,-,-,6.24
402,Maxim Danilin Dinamo Moscow,20, Midfielder,,1(1),69,-,-,0.5,-,-,-,-,-,6.24
403,Vadim Karpov CSKA Moscow,19, D(C),,12(1),983,1.8,1.1,1.2,0.2,2.2,1,0.1,-,6.23
404,Nayair Tiknizyan CSKA Moscow,22, D(L),M(L),0(5),34,-,0.2,0.6,-,-,-,-,-,6.23
405,Artem Fedchuk FC Tambov,26, Forward,,1(6),173,0.4,0.1,0.6,-,0.1,0.7,-,-,6.23
406,Reziuan Mirzov Spartak Moscow,28, AM(CL),FW,4(17),581,0.2,-,0.2,-,-,0.1,-,-,6.23
407,Chingiz Magomadov Ural,23, Defender,,1,90,1,-,1.0,-,3,2,1,-,6.23
408,Vladimir Abramov FC Rostov,19, Midfielder,,1,90,2,4,1.0,-,13,-,3,1,6.23
409,Jefferson Farfán Lokomotiv Moscow,37, M(CR),FW,0(3),75,0.3,-,1.0,-,0.3,-,-,-,6.23
410,Danila Smirnov Krylya Sovetov Samara,20, Midfielder,,0(3),52,1,-,0.3,-,-,-,-,-,6.22
411,Mikhail Ignatov Spartak Moscow,21, AM(C),,0(1),25,-,-,-,-,-,-,-,-,6.22
412,Andrés Vombergar FC Ufa,26, FW,,3(11),374,0.4,0.3,0.4,-,0.4,-,-,-,6.22
413,Oleg Baklov Ural,27, Goalkeeper,,3,270,-,-,-,-,2,-,-,-,6.22
414,Aleks Matsukatov FC Krasnodar,22, Midfielder,,0(2),25,1,0.5,-,-,-,0.5,-,-,6.22
415,Alexandru Gatcan FC Rostov,37, D(C),M(C),0(1),2,-,-,-,-,-,-,-,-,6.21
416,Emanuel Mammana Zenit,25, D(C),,2(1),78,0.7,0.3,-,-,1.3,0.3,0.3,-,6.21
417,Anri Khagush Arsenal Tula,35, D(LR),,4(3),347,1,0.3,0.9,-,3.3,0.3,0.1,-,6.2
418,Aleksandre Karapetian PFC Sochi,33, FW,,3(18),494,-,-,0.5,-,0.4,-,-,-,6.2
419,Vladimir Obukhov PFC Sochi,29, FW,,1(2),101,0.3,0.3,0.7,-,0.3,0.3,-,-,6.19
420,Lameck Banda Arsenal Tula,20, Midfielder,,1(8),139,0.3,0.1,1,-,0.2,0.3,-,-,6.19
421,Vladislav Tyurin Krylya Sovetov Samara,21, Midfielder,,0(1),6,1,-,-,-,-,-,-,-,6.19
422,Oleg Chernyshov FC Tambov,34, Midfielder,,2(6),216,0.8,1.1,0.4,-,0.1,0.8,0.1,-,6.19
423,Lechii Sadulaev FK Akhmat,21, Midfielder,,2(4),210,0.8,0.3,0.5,-,0.3,0.2,0.2,-,6.18
424,Artem Yusupov Ural,24, Forward,,0(3),44,0.7,-,0.3,-,0.3,0.3,-,-,6.18
425,Artem Galadzhan FC Orenburg,23, Forward,,0(4),43,-,-,0.5,-,0.3,0.3,-,-,6.18
426,Kamil Zakirov Rubin Kazan,23, M(C),,1(2),85,0.7,-,0.3,-,-,0.3,-,-,6.18
427,Khalid Kadyrov FK Akhmat,27, Midfielder,,0(1),19,-,-,-,-,-,-,-,-,6.17
428,Mamadou Sylla FC Orenburg,27, FW,,3(2),255,-,-,0.8,-,0.2,-,0.2,-,6.17
429,Roman Akbashev Rubin Kazan,30, Midfielder,,0(1),14,-,-,-,-,-,-,-,-,6.17
430,Dmitri Skopintsev FC Krasnodar,24, D(L),M(L),2(3),221,0.2,-,1,-,-,0.2,-,-,6.16
431,Mohammed Usman FC Tambov,27, Midfielder,,1,25,-,-,1,-,-,1,-,-,6.16
432,Danil Khromov FC Rostov,18, Forward,,1,80,2,-,1,-,-,3,-,-,6.15
433,Maksim Volodko Arsenal Tula,29, D(L),M(L),0(4),111,1,0.5,1,-,0.5,0.3,-,-,6.15
434,Samba Sow Dinamo Moscow,32, M(C),,0(1),10,-,-,-,-,-,-,-,-,6.15
435,Gamid Agalarov FC Ufa,21, FW,,3(2),243,0.2,0.2,1.2,-,-,-,-,-,6.15
436,Nikolay Kipiani Rubin Kazan,24, AM(R),,0(3),44,-,-,0.3,-,0.3,-,-,-,6.14
437,German Onugkha FC Krasnodar,25, FW,,0(2),24,-,-,0.5,-,-,-,-,-,6.14
438,Ilya Shkurin CSKA Moscow,22, FW,,0(4),110,-,-,0.3,-,-,0.3,-,-,6.14
439,Ivan Markelov FC Tambov,33, AM(CL),FW,3(2),199,0.2,0.2,0.6,-,0.4,0.4,-,-,6.14
440,Dmitri Efremov CSKA Moscow,26, M(LR),,1(1),28,-,-,0.5,-,-,-,-,-,6.14
441,Anton Terekhov Krylya Sovetov Samara,23, AM(CR),,1(11),259,0.2,0.3,0.2,-,0.3,0.1,-,-,6.13
442,Artur Nigmatullin Arsenal Tula,30, GK,,1,90,-,-,-,-,-,-,-,-,6.13
443,Nikita Makarov Rubin Kazan,20, Midfielder,,1(2),132,1,0.3,0.3,-,0.7,0.3,-,-,6.12
444,Nikita Bakaliuk Spartak Moscow,20, Midfielder,,0(1),1,-,-,-,-,-,-,-,-,6.12
445,Khasan Mamtov FC Tambov,37, Forward,,3(14),285,0.2,-,0.4,-,0.1,0.1,0.1,-,6.11
446,Dmitri Sysuev FC Ufa,33, AM(C),FW,1(1),84,0.5,-,1,-,0.5,-,-,-,6.1
447,Kirill Kaplenko FC Orenburg,22, Midfielder,,0(1),22,-,1,-,-,-,-,-,-,6.1
448,Nikita Sergeev FC Krasnodar,22, Midfielder,,0(4),41,0.5,-,0.3,-,-,0.3,-,-,6.1
449,Aleksandr Tashaev Spartak Moscow,27, AM(LR),,1(2),75,0.3,-,1,-,0.7,-,-,-,6.09
450,Soltmurad Bakaev Spartak Moscow,22, AM(LR),,0(2),16,-,-,0.5,-,-,0.5,-,-,6.09
451,Timur Suleymanov Lokomotiv Moscow,21, FW,,1(3),98,-,0.3,0.8,-,-,-,-,-,6.08
452,Vladimir Kabakhidze FC Tambov,22, M(C),,0(5),158,0.8,-,0.6,-,0.2,0.2,-,-,6.08
453,Ilya Golosov Spartak Moscow,20, Defender,,0(2),7,-,-,-,-,-,-,-,-,6.08
454,Nikita Kolotievskiy FC Rostov,20, Midfielder,,1,46,1,-,-,-,-,1,-,-,6.07
455,Roman Minaev Arsenal Tula,23, Forward,,0(3),35,-,-,0.3,-,-,0.3,0.3,-,6.07
456,Magomed Mitrishev FK Akhmat,29, AM(CLR),FW,2(7),164,0.1,0.1,0.4,-,0.1,0.1,-,-,6.06
457,Andrey Chasovskikh FC Tambov,30, Forward,,0(3),39,0.3,-,-,-,-,-,-,-,6.05
458,Ilya Vorotnikov FC Krasnodar,20, Forward,,0(1),16,1,-,1,-,-,-,-,-,6.05
459,Khetag Khosonov FC Tambov,23, Midfielder,,0(8),100,0.4,-,0.3,-,0.3,0.1,-,-,6.05
460,Egor Golenkov Krylya Sovetov Samara,22, Forward,,0(9),133,0.1,-,0.3,-,0.2,0.1,-,-,6.04
461,Guram Adzhoev Arsenal Tula,26, Forward,,0(1),4,-,-,-,-,-,-,-,-,6.04
462,Islamzhan Nasyrov Ural,23, Defender,,1(6),161,0.6,-,0.9,0.1,0.6,0.3,-,-,6.04
463,Dmitri Molchanov Krylya Sovetov Samara,21, Forward,,0(2),40,0.5,-,-,-,0.5,-,-,-,6.04
464,Alexander Lomovitskiy Spartak Moscow,23, M(LR),,1,61,1,-,2,-,-,-,-,-,6.03
465,Magomedemin Rabadanov FC Ufa,19, Forward,,0(1),3,-,-,-,-,-,-,-,-,6.03
466,Danil Khoroshkov FC Orenburg,19, Defender,,0(1),3,-,-,-,-,-,-,-,-,6.02
467,Tamaz Topuriya FC Rostov,19, Forward,,1,61,2,-,2,-,2,-,-,-,6.02
468,Aleksandr Dolgov FC Rostov,23, Forward,,1(14),167,0.5,0.1,0.4,-,-,0.3,-,-,6.02
469,Aleksandr Dovbnya FC Orenburg,34, GK,,6,451,-,-,0.2,-,1.2,-,-,-,6.0
470,Artur Cherny Lokomotiv Moscow,20, Defender,,0(1),1,-,-,-,-,-,-,-,-,6.0
471,Dmitri Markitesov Spartak Moscow,20, Midfielder,,0(2),2,-,-,0.5,-,-,0.5,-,-,6.0
472,Maksim Glushenkov Spartak Moscow,22, FW,,0(1),1,-,1,-,-,-,-,-,-,6.0
473,Nikita Salamatov FC Tambov,27, Midfielder,,0(1),1,-,-,-,-,-,-,-,-,6.0
474,Maksim Kutovoi FC Krasnodar,20, Forward,,0(3),38,-,-,-,-,0.3,-,-,-,5.98
475,Yuri Kovalev Arsenal Tula,28, M(LR),,1(4),159,0.8,-,0.4,-,0.2,0.2,-,-,5.98
476,Danil Klenkin FC Tambov,31, Midfielder,,0(3),126,-,-,0.7,-,-,-,-,-,5.97
477,David Bidlovsky FC Orenburg,22, Midfielder,,0(2),51,-,0.5,-,-,0.5,-,-,-,5.97
478,Evgeny Cherkes FC Rostov,20, Midfielder,,0(1),2,-,-,-,-,-,1,-,-,5.96
479,Gennadi Kiselyov Krylya Sovetov Samara,22, Midfielder,,0(2),30,-,-,0.5,-,0.5,0.5,-,-,5.96
480,Nikita Kupriyanov FC Rostov,19, Midfielder,,1,73,1,4,2,-,1,1,-,-,5.95
481,Daniil Krivoruchko FC Orenburg,23, Defender,,0(2),19,-,-,0.5,-,-,-,-,-,5.92
482,Mikhail Lysov Lokomotiv Moscow,23, D(L),,0(1),27,-,-,1,-,-,1,-,-,5.92
483,Ivan Lapshov FC Orenburg,22, Defender,,0(1),6,-,-,-,-,-,-,-,-,5.91
484,Amur Kalmykov FC Tambov,27, Forward,,1(2),63,-,-,0.7,-,0.3,-,-,-,5.89
485,Azamat Zaseev FC Ufa,33, DMC,,0(1),6,-,-,-,-,-,-,-,-,5.89
486,Danila Vedernikov FC Rostov,20, Defender,,0(5),45,0.6,-,0.6,-,0.2,-,-,-,5.88
487,Timofey Kalistratov FC Rostov,18, Midfielder,,1,90,4,3,-,2,12,2,3,-,5.87
488,Artyom Rebrov Spartak Moscow,37, GK,,2,91,-,-,-,-,-,-,-,-,5.83
489,Danila Proshlyakov FC Rostov,21, Forward,,1(6),142,0.1,-,1.6,-,0.1,-,-,-,5.8
490,Safaa Hadi Krylya Sovetov Samara,23, Midfielder,,0(4),52,0.5,-,1.3,-,0.3,0.3,-,-,5.79
491,Maxim Stavcev FC Rostov,17, Midfielder,,0(1),10,-,-,-,-,-,-,-,-,5.78
492,Ivan Komarov FC Rostov,18, Midfielder,,0(1),29,-,-,-,-,-,1,-,-,5.71
493,Yuri Lodygin Arsenal Tula,31, GK,,2,180,-,-,-,-,-,-,-,-,5.7
494,Nikita Kashtan FC Rostov,18, Midfielder,,0(1),17,-,-,-,-,1,1,-,-,5.68
495,Artem Mamin Ural,24, D(C),,1,90,4,2,1,4,6,1,-,-,5.25
496,Aleksey Kornieko FC Rostov,18, Midfielder,,0(1),45,-,-,-,-,-,2,-,-,5.23
497,Krill Girnyk FC Rostov,18, Midfielder,,1,90,3,2,1,-,3,-,1,-,4.71
498,Pavel Gorelov FC Rostov,18, Midfielder,,1,90,-,1,2,-,1,4,1,-,4.66
499,Vilyam Rogava FC Rostov,18, Midfielder,,1,90,1,2,2,-,4,1,1,-,3.91
