,name,age,position1,position2,Apps,Mins,Tackles,Inter,Fouls,Offsides,Clear,Drb,Blocks,OwnG,Rating
0,Denis Popov FC Rostov,19, Goalkeeper,,1,90,-,-,-,-,1.0,-,-,-,8.04
1,Fernando Spartak Moscow,29, M(C),,3,270,2,3,1.3,-,1.3,0.7,-,-,7.85
2,Artem Dzyuba Zenit,33, FW,,25(3),2316,0.4,0.1,1,-,0.6,0.1,0.1,-,7.63
3,Nikola Vlasic CSKA Moscow,24, AM(CLR),FW,30,2651,1,0.3,1.1,-,0.4,1,-,-,7.5
4,Cedric Gogoua FC Tambov,27, D(C),,5,450,1.2,1.6,1,0.2,5.6,0.8,1,-,7.43
5,Aleksandr Kokorin PFC Sochi,30, AM(CLR),FW,10,879,1,0.1,1.1,-,0.6,0.5,0.2,-,7.37
6,Magomed Ozdoev Zenit,29, M(C),,26,2183,2.5,1.6,1.9,-,1.5,0.7,0.4,-,7.36
7,Sardar Azmoun Zenit,26, FW,,24(4),2102,0.6,0.3,1.2,-,0.8,0.5,-,-,7.34
8,Malcom Zenit,24, AM(CLR),,9(3),829,0.5,0.1,0.3,-,0.2,0.4,-,-,7.33
9,Aleksey Miranchuk Lokomotiv Moscow,26, M(CR),FW,25(2),2273,1.2,0.6,0.8,-,0.2,0.8,-,-,7.31
10,Nikita Koldunov PFC Sochi,21, Midfielder,,0(2),49,1,0.5,1.0,-,-,0.5,-,-,7.28
11,Samuel Gigot Spartak Moscow,28, D(C),,26,2332,2,1.7,1.3,0.5,3.7,0.3,1,-,7.27
12,Douglas Santos Zenit,27, D(CL),DMC,27(1),2452,1.9,1.5,0.7,0.1,1.4,1.2,0.1,1,7.27
13,Christian Noboa PFC Sochi,36, M(C),,18(1),1606,2.4,2.1,1.2,-,1.2,1.3,0.3,-,7.26
14,Kantemir Berkhamov Arsenal Tula,33, DMC,,1,64,-,1.0,1.0,-,2,2.0,-,-,7.25
15,Sly FC Ufa,31, AM(CL),FW,6,483,0.3,0.5,2.2,-,1,0.3,0.2,-,7.23
16,Ilya Gaponov Spartak Moscow,24, D(C),,4,360,2.8,1.3,0.5,0.8,3.3,1.5,0.8,-,7.22
17,Wanderson Maciel FC Krasnodar,27, AM(LR),,20(1),1817,1,0.2,0.8,-,-,0.4,-,-,7.22
18,Ivan Oblyakov CSKA Moscow,23, D(L),M(CL),28,2461,1.6,1.2,1.6,-,0.7,1.1,0.3,-,7.17
19,Grzegorz Krychowiak Lokomotiv Moscow,31, D(C),M(C),26,2274,1.2,1.2,1.5,-,0.9,0.4,0.4,-,7.16
20,Maksim Osipenko FC Rostov,27, D(C),,9,810,1.0,1.4,0.3,0.6,5.4,0.1,0.6,1,7.16
21,Filip Uremovic Rubin Kazan,24, D(CR),,25,2250,2.6,2.6,1.3,0.7,3.7,0.3,0.2,-,7.16
22,Zelimkhan Bakaev Spartak Moscow,25, AM(CLR),,26(1),2183,0.9,0.4,1.7,0.1,0.3,0.9,0.1,-,7.15
23,Dmitriy Chistyakov FC Rostov,27, D(C),,22,1757,1.2,2.1,1.0,0.3,4.7,0.2,1,-,7.14
24,Mario Fernandes CSKA Moscow,31, D(R),M(R),29,2604,1.8,1.1,1.0,0.1,1.2,0.6,0.3,-,7.13
25,Alexey Nikitin FC Ufa,29, D(CR),,8,708,0.6,2.1,0.9,0.6,5.4,0.3,1.1,-,7.13
26,Kaio FC Krasnodar,26, D(C),DMC,10(1),907,2.1,3.1,1.5,0.6,2.5,0.2,0.7,-,7.13
27,Jimmy Tabidze FC Ufa,25, D(C),,25,2227,2.8,1.8,0.9,0.2,4.5,0.5,0.5,1,7.12
28,Eldor Shomurodov FC Rostov,26, FW,,28,2365,0.8,0.1,1.8,-,1.0,0.6,-,-,7.11
29,Djorde Despotovic FC Orenburg,29, FW,,20,1755,0.7,0.3,1.5,0.1,1.0,0.3,0.1,-,7.11
30,Anton Kochenkov Lokomotiv Moscow,34, GK,,6(1),597,0.1,-,-,-,1.3,-,-,-,7.11
31,Uros Radakovic FC Orenburg,27, D(C),,15,1350,1.3,2.1,1.2,0.6,7.3,0.1,1,1,7.11
32,Vitali Lystsov Krylya Sovetov Samara,26, D(C),,7(1),604,2,1.6,1,0.3,3.6,0.6,0.8,-,7.11
33,Yaroslav Rakitskiy Zenit,32, D(C),,27,2420,0.8,1.6,1.1,0.4,3.1,0.3,0.7,-,7.11
34,Vladimir Obukhov FC Tambov,29, FW,,17,1455,0.4,0.2,1,-,0.8,0.2,-,-,7.11
35,Yuri Dyupin Rubin Kazan,33, GK,,30,2700,-,-,-,-,1.3,-,-,-,7.1
36,Nikita Chernov Krylya Sovetov Samara,25, D(C),,23,2070,1.5,2.6,1.2,0.5,6.4,0.5,1,-,7.1
37,Alexander Sobolev Krylya Sovetov Samara,24, FW,,18,1583,0.4,0.1,1.6,-,0.8,-,0.2,-,7.09
38,Wilmar Barrios Zenit,28, DMC,,25(1),2225,2.5,1.5,1,0.1,1.0,0.7,0.4,-,7.09
39,Soslan Dzhanaev PFC Sochi,34, GK,,22,1980,-,-,-,-,0.5,-,-,-,7.08
40,Egor Sorokin Rubin Kazan,26, D(C),,13(1),1242,1.4,2.6,0.7,0.5,3.6,0.7,1,-,7.08
41,Kirill Zaika PFC Sochi,29, M(LR),,10,875,0.9,1.3,1.6,0.1,1.0,0.5,-,-,7.08
42,João Mário Lokomotiv Moscow,28, M(CLR),,16(2),1477,0.7,0.5,0.8,-,0.3,0.2,-,-,7.08
43,Ayrton Spartak Moscow,24, D(L),M(L),27,2306,2.3,1.3,1.4,0.2,1.9,0.7,0.2,-,7.08
44,Pablo Santos Rubin Kazan,29, D(C),,9,783,1.2,1.6,0.6,0.8,6.1,0.1,0.6,1,7.07
45,Aleksandr Melikhov FK Akhmat,23, GK,,1,90,-,-,-,-,1.0,-,-,-,7.06
46,Aleksandr Putsko FC Ufa,28, D(C),,19(1),1686,0.8,1.4,0.9,0.4,7.1,0.5,1.4,-,7.04
47,Hördur Magnússon CSKA Moscow,28, D(CL),,26(1),2385,1.5,1.7,1.1,0.4,3.1,0.6,0.6,-,7.04
48,George Melkadze FC Tambov,24, AM(CL),FW,18,1521,1.4,1.3,2.2,-,0.4,0.4,0.2,-,7.04
49,Denis Adamov FC Krasnodar,23, Goalkeeper,,1(1),161,-,-,-,-,0.5,-,-,-,7.04
50,Toni Sunjic Dinamo Moscow,32, D(C),,17(2),1522,2.2,1.9,0.9,0.2,5.2,0.7,0.6,-,7.03
51,Aleksandr Martynovich FC Krasnodar,34, D(CR),,21(1),1894,1.3,2.3,0.8,0.5,3.7,0.6,0.8,-,7.03
52,Evgeni Frolov PFC Sochi,33, GK,,1,90,-,-,-,-,4.0,-,-,-,7.03
53,Roman Zobnin Spartak Moscow,27, M(CLR),,24(1),2157,1.6,1.2,1.4,0.1,1.4,0.7,0.2,-,7.03
54,Vladislav Ignatjev Lokomotiv Moscow,34, D(LR),M(CLR),23,1986,2.8,1.6,1.6,0.5,2.4,1,0.3,-,7.02
55,Daniil Fomin FC Ufa,24, DMC,,27,2430,1.4,1.4,0.9,-,1.6,0.4,0.4,-,7.01
56,Branislav Ivanovic Zenit,37, D(CR),,25,2221,0.7,0.8,0.4,0.4,3.3,0.1,0.5,-,7.01
57,Ivelin Popov FC Rostov,34, M(CLR),FW,23(2),1949,1,0.8,1.5,-,1.4,0.8,0.2,-,7.0
58,Odise Roshi FK Akhmat,30, M(CR),,19(7),1755,1.6,0.4,1.8,-,0.8,0.5,-,-,7.0
59,Sebastián Driussi Zenit,25, AM(CLR),FW,20(5),1678,1.1,0.4,1.2,-,0.3,1.2,0.1,-,6.99
60,Ivan Ordets Dinamo Moscow,29, D(C),,16(1),1442,0.9,2.5,1.0,0.2,4.0,0.2,0.6,-,6.99
61,Artem Timofeev Krylya Sovetov Samara,27, M(C),,18(3),1593,3.1,2.5,1.0,-,2.0,1.6,0.4,-,6.99
62,Anton Zabolotny PFC Sochi,30, FW,,16(5),1354,0.4,0.1,1.3,-,0.4,0.2,-,-,6.98
63,Andrey Mostovoy PFC Sochi,24, AM(CLR),,24(1),2079,0.7,0.3,0.9,-,0.4,0.7,0.1,-,6.97
64,Vladimir Rykov Dinamo Moscow,34, D(C),,18(1),1608,1.8,1.9,0.7,0.2,3.6,0.5,0.9,-,6.97
65,Igor Bezdenezhnykh FC Ufa,25, DMC,,2,180,2.5,2,0.5,-,3.5,0.5,-,-,6.97
66,Roman Eremenko FC Rostov,34, M(CLR),,16(3),1531,0.8,0.3,1.4,-,0.8,1.1,0.1,-,6.97
67,Georgy Schennikov CSKA Moscow,30, D(L),M(L),9,765,1.7,0.8,1.6,0.1,1.4,0.7,0.3,-,6.96
68,Othman El Kabir Ural,30, AM(L),,20(2),1638,0.8,0.8,0.9,-,0.4,0.3,-,-,6.96
69,Andrey Lunev Zenit,30, GK,,19,1706,-,-,0.1,-,1.1,0.1,-,-,6.95
70,Baktiyor Zainutdinov FC Rostov,23, D(L),M(CLR),10(7),1042,1.4,0.6,1.5,-,0.5,0.3,0.1,-,6.95
71,Maksim Osipenko FC Tambov,27, D(C),,17,1520,1.9,1.8,0.4,0.2,5.6,0.8,1.1,-,6.95
72,Mikhail Kerzhakov Zenit,34, GK,,9(1),814,-,-,-,-,0.5,-,-,-,6.95
73,Oleg Shatov Zenit,31, M(CLR),,5(7),585,1,0.5,0.5,-,0.1,0.3,0.3,1,6.94
74,Ilya Samoshnikov Rubin Kazan,24, D(LR),,5(1),472,3.5,1.7,1.2,0.3,2.2,1.3,-,-,6.94
75,Fedor Smolov Lokomotiv Moscow,31, AM(CL),FW,10(4),924,0.6,0.1,0.9,-,0.6,0.2,0.1,-,6.94
76,Maximilian Philipp Dinamo Moscow,27, AM(CLR),FW,15(5),1256,0.8,0.5,0.8,-,0.3,0.6,-,-,6.94
77,Mathias Normann FC Rostov,25, M(C),,22(1),1995,1.6,1.2,1.8,-,1.1,0.8,0.4,-,6.93
78,Aleksey Ionov FC Rostov,32, AM(CLR),FW,25,2124,0.7,0.4,0.4,-,0.3,0.8,-,-,6.92
79,Evgeni Lutsenko Arsenal Tula,34, FW,,25(3),2184,0.3,0.1,1.5,-,0.6,0.1,0.1,-,6.91
80,Igor Diveev CSKA Moscow,22, D(C),,26,2296,1.1,1.3,1.1,0.5,4.5,0.7,0.7,-,6.91
81,Sergei Ryzhikov Krylya Sovetov Samara,41, GK,,19,1710,0.1,-,-,-,0.3,0.1,-,1,6.91
82,Uros Spajic FC Krasnodar,28, D(C),,15,1350,0.9,2.3,1.7,0.5,2.6,0.3,0.7,-,6.91
83,Denis Popovic Krylya Sovetov Samara,32, M(CR),,8(2),715,0.2,0.4,0.2,-,0.7,0.2,-,-,6.91
84,Ari FC Krasnodar,35, AM(R),FW,18,1549,0.2,0.1,1.7,-,0.8,0.2,0.1,-,6.91
85,Vedran Corluka Lokomotiv Moscow,35, D(C),,27,2357,0.7,1.3,0.4,0.6,5.6,0.2,0.6,-,6.9
86,Ivan Novoseltsev PFC Sochi,30, D(CLR),,18,1551,0.9,2.4,0.4,0.5,4.1,0.4,0.6,-,6.9
87,Goran Causic Arsenal Tula,29, M(C),,20(1),1736,1.8,1.3,1.4,-,1.6,0.3,0.3,-,6.89
88,Ricardo Alves FC Orenburg,28, AM(CLR),,21,1700,1.2,0.9,1,-,0.4,1.3,-,-,6.89
89,Maksim Glushenkov Krylya Sovetov Samara,22, FW,,8(2),649,1.4,0.4,1.1,-,0.2,0.6,-,-,6.89
90,Aleksandr Belenov FC Ufa,35, GK,,26,2340,0.1,-,-,-,1.0,-,-,-,6.88
91,Roman Evgenjev Dinamo Moscow,22, D(C),,11(3),1021,1.5,1.5,0.9,0.4,4.4,0.4,0.5,-,6.88
92,Igor Smolnikov Zenit,33, D(LR),M(R),11(1),858,1.0,1.4,1,0.4,0.8,0.1,-,-,6.88
93,Taras Burlak Krylya Sovetov Samara,31, D(C),,8,687,0.8,1.8,0.4,0.3,5.1,0.4,1.5,-,6.88
94,Mikhail Merkulov Ural,27, D(L),,18,1569,2.8,2.1,0.6,0.7,2.1,0.7,0.3,-,6.88
95,Cedric Gogoua CSKA Moscow,27, D(C),,3(1),185,1.3,1.8,0.3,0.3,2.0,-,0.8,-,6.88
96,Daniil Khlusevich Arsenal Tula,20, D(R),M(R),4(1),367,2.6,0.6,1.4,-,2.6,1.2,-,-,6.87
97,Daniil Lesovoy Arsenal Tula,23, AM(CL),,22(5),1973,1.1,0.4,1,-,0.2,0.7,-,-,6.87
98,Wilker Ángel FK Akhmat,28, D(C),,18(1),1574,0.9,2,1.3,0.9,4.1,0.4,0.9,-,6.86
99,Catalin Carp FC Ufa,28, DMC,,24,2132,2.0,1.6,1.3,-,2.0,1.9,0.3,-,6.86
100,Carl Starfelt Rubin Kazan,26, D(C),,10,900,0.7,1.8,0.8,0.2,4.4,0.1,0.9,-,6.86
101,Egor Shamov Arsenal Tula,27, GK,,9,810,0.1,0.1,0.1,-,1.2,-,-,-,6.86
102,Maxim Karpov Krylya Sovetov Samara,26, D(C),,21,1882,2,2.2,1.4,0.4,3.9,0.6,0.8,-,6.86
103,Murilo Cerqueira Lokomotiv Moscow,24, D(C),DMC,21(4),1809,1.8,1.4,1,0.5,4.0,0.4,0.3,-,6.85
104,Miroslav Bogosavac FK Akhmat,25, D(L),,9(1),836,2.9,1.9,0.6,-,1.3,0.8,0.2,-,6.85
105,Vyacheslav Karavaev Zenit,26, D(LR),M(R),17(3),1499,2.1,0.7,0.6,0.1,1.7,0.7,0.2,-,6.85
106,Nikolay Zabolotny PFC Sochi,31, GK,,5,450,0.2,-,-,-,1.8,0.2,-,-,6.85
107,Guilherme Lokomotiv Moscow,35, GK,,24,2103,-,-,-,-,0.5,-,-,-,6.85
108,Daniil Krugovoy FC Ufa,23, D(L),M(L),8(4),775,1.6,1.6,0.5,0.1,1.3,0.5,0.2,-,6.85
109,Ruslan Kambolov FC Krasnodar,31, D(C),DMC,10(6),902,1.6,1.8,1.3,0.1,0.9,0.6,0.3,-,6.84
110,Yordan Osorio Zenit,27, D(C),,4(3),443,0.7,1.6,0.4,-,3.1,0.6,0.7,-,6.84
111,Ivan Miladinovic PFC Sochi,27, D(C),,22,1925,1.2,1.8,1.1,0.9,4.9,0.5,0.7,-,6.84
112,Nikita Burmistrov PFC Sochi,32, AM(CLR),FW,19(4),1573,1.8,0.6,1.3,-,0.7,1.7,0.1,-,6.84
113,Dmitri Barinov Lokomotiv Moscow,25, D(C),M(C),23,2070,1.9,1.4,1.9,-,1.6,1.2,0.4,-,6.84
114,Miha Mevlja PFC Sochi,31, D(C),,19,1626,1.2,1.2,0.9,0.6,4.9,0.4,0.6,1,6.83
115,Tonny Vilhena FC Krasnodar,26, D(L),M(CL),20,1725,1.0,1.4,1.5,-,0.9,0.6,0.4,-,6.83
116,Eric Bicfalvi Ural,33, AM(C),FW,24(2),2098,1.1,0.4,1.8,-,1.2,0.8,0.3,-,6.83
117,Khvicha Kvaratskhelia Rubin Kazan,20, AM(LR),,14(13),1469,1.0,0.6,0.6,-,0.3,0.7,0.1,-,6.83
118,Rémy Cabella FC Krasnodar,31, M(CLR),FW,5(4),362,1.4,0.7,1.0,-,-,0.2,-,-,6.83
119,Ionut Nedelcearu FC Ufa,25, D(C),,20,1775,1.5,2.0,0.7,0.5,3.1,0.3,0.6,-,6.83
120,Viktor Vasin CSKA Moscow,33, D(C),,9(2),730,0.9,1.6,0.7,0.5,2.5,0.1,0.3,-,6.83
121,Anton Miranchuk Lokomotiv Moscow,26, AM(CLR),FW,13(4),1111,1.3,0.5,1.1,-,0.2,0.6,0.1,-,6.82
122,Georgi Kostadinov Arsenal Tula,31, D(C),M(C),23(1),2020,2.0,1.9,1.6,0.1,2.7,0.7,0.3,-,6.82
123,Georgi Dzhikiya Spartak Moscow,27, D(CL),,27,2423,1.2,1.3,0.9,0.5,3.8,0.2,1,-,6.81
124,Ismael Silva FK Akhmat,26, M(CL),,28(1),2507,1.4,0.9,1.8,-,0.6,0.8,-,-,6.81
125,Oston Urunov FC Ufa,20, AM(C),,9(1),805,1.1,0.5,1.9,-,0.4,0.5,-,-,6.81
126,Rafal Augustyniak Ural,28, D(C),DMC,24(5),2260,2.3,1.0,1.2,-,0.9,1.2,0.5,-,6.81
127,Dmitri Kombarov Krylya Sovetov Samara,34, D(L),M(L),20(2),1708,1.3,1.7,0.5,-,1.7,0.6,0.3,-,6.8
128,Kirill Kombarov Arsenal Tula,34, D(R),M(R),16(3),1407,2.2,0.7,1.5,0.1,1.8,0.9,0.1,-,6.8
129,Anton Zinkovskiy Krylya Sovetov Samara,25, AM(L),,21(6),1895,1.0,0.4,0.6,-,0.5,1.1,-,-,6.8
130,Varazdat Haroyan Ural,29, D(C),,17(1),1531,1.6,1.5,1.6,0.4,3.9,0.4,0.8,-,6.8
131,Andrey Semenov FK Akhmat,32, D(CR),,30,2700,1.2,2.4,0.5,0.5,4.2,0.5,0.9,1,6.8
132,Aleksey Kozlov FC Rostov,34, D(R),M(R),24,2144,2,1.4,0.8,0.3,2.1,0.7,0.5,-,6.8
133,Vladislav Panteleev Arsenal Tula,25, AM(CR),,3(3),273,0.3,0.3,0.3,0.2,0.3,-,0.2,-,6.79
134,Igor Konovalov Rubin Kazan,25, DMC,,27(2),2464,1.6,1.2,0.9,-,1.6,0.8,0.5,-,6.79
135,Maciej Rybus Lokomotiv Moscow,32, D(LR),M(LR),18(1),1613,1.4,2.2,1.4,0.2,2.4,0.5,0.4,-,6.79
136,Éder Lokomotiv Moscow,33, FW,,20(3),1728,0.4,0.2,1.3,-,0.9,0.1,0.1,-,6.79
137,Roman Neustädter Dinamo Moscow,33, D(C),M(C),19(1),1675,1.6,1.5,1.2,0.1,1.6,0.8,0.2,-,6.79
138,Stanislav Kritsyuk FC Krasnodar,30, GK,,1,90,-,-,-,-,-,-,-,-,6.79
139,Khoren Bayramyan FC Rostov,29, D(LR),M(CL),24(2),1878,1,0.7,1,-,0.4,1.2,0.1,-,6.79
140,Egor Sorokin FC Krasnodar,26, D(C),,6(2),563,1.3,0.5,0.6,0.3,2.1,0.3,0.8,-,6.78
141,Konstantin Rausch Dinamo Moscow,31, D(L),M(L),16(2),1384,1.1,1.6,0.7,-,0.9,0.6,0.1,-,6.78
142,Cristian Ramírez FC Krasnodar,27, D(LR),,24(2),2179,1.2,0.9,1.1,0.1,1.0,0.3,0.2,-,6.78
143,Maksim Kanunnikov Krylya Sovetov Samara,30, AM(LR),FW,12(3),1126,1.1,0.7,1.3,0.1,0.9,0.1,0.2,-,6.77
144,Joãozinho Dinamo Moscow,32, M(CLR),FW,18(1),1417,1.3,0.6,0.8,-,0.3,0.9,-,-,6.77
145,Stanislav Magkeev Lokomotiv Moscow,22, D(C),DMC,7(3),691,1.3,2.0,1.8,0.2,3.2,0.3,0.5,-,6.77
146,Denys Kulakov Ural,35, D(R),,28,2452,1.4,1.2,0.8,0.1,2.4,1.0,0.2,-,6.77
147,Aleksey Gritsaenko FC Tambov,26, D(C),,19,1710,1.0,1.3,1.3,0.2,4.8,0.4,1.2,-,6.77
148,Sly Dinamo Moscow,31, AM(CL),FW,17(3),1503,1.1,0.3,1.5,-,0.3,0.6,0.1,-,6.77
149,Alex Král Spartak Moscow,23, DMC,,18(1),1634,1.9,1.2,0.6,0.2,1.1,0.5,0.2,-,6.77
150,Guram Tetrashvili FC Tambov,33, D(R),DMC,24(1),2075,2,2.1,1.1,-,2.2,1,0.4,-,6.77
151,Aleksandr Maksimenko Spartak Moscow,23, GK,,29,2610,-,-,-,-,0.6,-,-,-,6.76
152,Evgeny Kharin FK Akhmat,26, M(LR),,17(5),1644,2.1,1.2,2,0.1,1.8,1,0.2,-,6.76
153,Marcus Berg FC Krasnodar,35, FW,,15(8),1392,0.3,0.3,1.1,-,0.4,0.2,-,-,6.76
154,Giannelli Imbula PFC Sochi,29, M(C),,0(1),31,1,-,-,-,-,-,-,-,6.76
155,Pavel Shakuro PFC Sochi,24, Defender,,1(1),121,1.5,-,0.5,-,2,1,0.5,-,6.76
156,Andrey Klimovich FC Orenburg,33, GK,,20,1800,0.1,-,0.1,-,0.5,0.1,-,-,6.76
157,Víctor Álvarez Arsenal Tula,28, D(L),M(L),24,2050,1.5,0.9,0.8,0.1,1.9,0.8,0.3,-,6.76
158,Aleksandr Tashaev Rubin Kazan,27, AM(LR),,7,571,2.3,1,1.9,-,0.6,0.6,-,-,6.75
159,Sergey Petrov FC Krasnodar,30, D(LR),M(C),27,2332,1.1,1.1,0.8,0.2,1.2,0.6,0.2,-,6.75
160,Evgeni Chernov FC Rostov,29, D(L),M(L),29,2607,0.8,1,0.6,0.2,2.3,0.4,0.3,-,6.75
161,Roland Gigolaev FK Akhmat,31, D(L),M(L),8,659,2.4,1.8,1.6,0.3,1.4,1.1,0.3,-,6.75
162,Yuri Gazinskiy FC Krasnodar,32, DMC,,10(1),847,1.5,1.7,0.5,-,0.5,0.5,0.1,-,6.75
163,Maksim Belyaev Arsenal Tula,30, D(C),,29,2610,0.8,1.4,0.7,0.5,6,0.4,0.6,-,6.75
164,Rifat Zhemaletdinov Lokomotiv Moscow,25, M(CLR),FW,18(5),1618,1.3,0.4,2.2,-,0.7,0.7,0.2,-,6.75
165,Denis Terentjev Zenit,29, D(LR),,1(1),117,1.5,-,0.5,-,2,-,0.5,-,6.74
166,Valeriu Ciuperca FC Tambov,29, M(C),,20(3),1801,1.9,1,1.8,-,0.8,1,0.3,-,6.74
167,Manuel Fernandes FC Krasnodar,35, M(CL),,10(6),834,0.6,0.2,0.7,-,-,0.2,0.1,-,6.74
168,Aleksandr Dovbnya Arsenal Tula,25, D(C),,4(1),405,1.0,1.6,1.0,0.8,4,0.6,0.6,-,6.73
169,Paul-Viorel Anton Krylya Sovetov Samara,30, M(C),,14(3),1163,1.6,0.9,1.2,-,0.5,1.1,0.2,-,6.73
170,Robert Bauer Arsenal Tula,26, D(CLR),DMC,12(2),1109,2.1,1.8,1.1,0.1,2.9,0.5,0.2,-,6.73
171,Zvonimir Sarlija CSKA Moscow,25, D(C),,6(5),740,1.6,2.4,1.4,0.2,2.1,0.8,0.2,-,6.73
172,Timofey Margasov PFC Sochi,29, D(CLR),M(R),12(3),1063,1.5,0.5,0.6,0.1,2.3,1.1,0.4,-,6.73
173,Aleksey Gerasimov Ural,28, D(C),,4,360,0.8,1.8,0.5,1.5,3.0,0.3,1,-,6.73
174,Fedor Chalov CSKA Moscow,23, AM(CR),FW,29(1),2466,0.3,0.2,0.8,-,0.5,0.5,-,-,6.73
175,Oleg Danchenko Rubin Kazan,27, D(R),M(R),19,1607,1.3,0.8,0.6,0.2,1.4,0.4,0.2,-,6.73
176,Igor Gorbatenko Arsenal Tula,32, M(CLR),,20(4),1849,1.2,0.4,1.3,-,0.8,1.2,0.1,-,6.73
177,Ilya Kutepov Spartak Moscow,28, D(C),,10(1),820,1.0,3.0,1.4,0.5,3.3,0.3,0.8,1,6.72
178,Jón Fjóluson FC Krasnodar,32, D(C),,8(2),722,0.6,0.8,0.4,0.2,3.8,0.1,0.8,-,6.72
179,Sergey Tkachev Arsenal Tula,32, M(CLR),,22(5),1849,1.0,0.4,0.9,-,0.7,0.9,-,-,6.72
180,Dmitriy Stotskiy FC Krasnodar,31, D(LR),M(CLR),8(4),721,2.1,0.8,0.6,-,1.2,0.5,0.2,-,6.72
181,Bernard Berisha FK Akhmat,30, M(CLR),FW,17(5),1437,1.1,0.2,1.4,-,0.2,0.7,0.1,-,6.71
182,Sergey Terekhov FC Orenburg,31, D(CL),M(L),27,2430,1.4,1.9,1.2,0.2,2.7,0.9,0.4,-,6.71
183,Nikita Kalugin PFC Sochi,23, D(CR),,13(3),1163,2,2.6,1.0,0.1,2.3,1.1,0.1,1,6.71
184,Oliver Abildgaard Rubin Kazan,25, DMC,,10(1),824,1.3,1.1,1.5,0.1,1.6,0.5,0.6,-,6.71
185,Alexandru Gatcan Krylya Sovetov Samara,37, D(C),M(C),21(1),1787,2.9,1,1.6,-,0.8,1.3,0.4,-,6.71
186,Fedor Kudryashov PFC Sochi,34, D(CL),M(L),15(1),1338,2,1.3,1.2,0.2,2.2,0.5,0.6,-,6.7
187,Evgeni Frolov Krylya Sovetov Samara,33, GK,,10,900,-,-,0.1,-,1.0,-,-,-,6.7
188,Ilzat Akhmetov CSKA Moscow,23, M(CR),,17(4),1376,1.5,1,1.1,-,0.5,0.6,0.3,-,6.7
189,André Schürrle Spartak Moscow,31, M(CLR),FW,9(4),829,0.6,0.2,0.8,-,0.4,0.2,0.1,-,6.7
190,Alexander Sobolev Spartak Moscow,24, FW,,6(5),626,0.3,0.1,1.4,-,0.4,0.6,-,-,6.69
191,Ade FC Tambov,39, D(C),,26,2276,0.8,1.6,0.5,0.1,4.6,0.5,0.6,1,6.69
192,Jordan Larsson Spartak Moscow,24, AM(CR),FW,19(7),1619,0.4,0.3,0.9,-,0.2,0.5,-,-,6.69
193,Kristoffer Olsson FC Krasnodar,26, M(C),,23(4),1931,1.1,0.9,1.2,-,0.6,1.1,0.1,-,6.69
194,Sergey Parshivlyuk Dinamo Moscow,32, D(R),M(R),15(2),1344,1.6,1,0.8,0.1,1.5,0.4,0.2,-,6.69
195,Anton Shunin Dinamo Moscow,34, GK,,23,1994,-,-,-,-,0.8,-,-,-,6.69
196,Mihail Levashov Arsenal Tula,30, GK,,18,1620,-,-,0.1,-,1.3,-,-,-,6.68
197,Aleksey Rybin FC Tambov,33, D(R),M(R),19,1597,1.5,1.1,0.6,0.1,1.6,0.5,0.5,-,6.68
198,Ibrahim Tsallagov PFC Sochi,30, D(LR),DMC,25(1),2212,2.1,1.5,1.2,-,0.7,0.9,0.6,-,6.68
199,Benedikt Höwedes Lokomotiv Moscow,33, D(CLR),,18,1565,1.4,1.8,0.8,0.5,3.6,0.4,0.6,-,6.68
200,Nikita Chicherin Krylya Sovetov Samara,31, D(CR),,4(2),403,1.7,1.2,1.7,0.2,2.7,0.2,0.2,-,6.68
201,Denis Polyakov Ural,30, D(CLR),,15(2),1440,1.3,1.9,0.8,0.4,5.0,0.5,1,-,6.68
202,Igor Akinfeev CSKA Moscow,35, GK,,30,2700,-,-,-,-,0.4,-,-,-,6.68
203,Artur Yusupov Dinamo Moscow,32, M(CL),,19(2),1425,1.9,1,1.7,-,0.4,1.6,0.2,-,6.68
204,Dusan Lagator PFC Sochi,27, DMC,,6(7),701,1.8,0.9,1.2,0.1,1.7,0.8,0.5,-,6.68
205,Vitaliy Denisov Rubin Kazan,34, D(L),M(L),7(1),598,2.6,2,2.1,0.1,1.3,0.4,0.3,-,6.67
206,Dmitri Skopintsev Dinamo Moscow,24, D(L),M(L),10,805,1.6,0.6,0.5,0.1,1.4,0.5,0.1,-,6.67
207,Yuri Zhirkov Zenit,38, D(L),M(CL),13(8),1171,0.4,0.4,0.7,-,0.5,0.1,0.1,-,6.67
208,Sebastian Szymanski Dinamo Moscow,22, AM(CR),,18(4),1596,2.5,0.4,1.4,-,0.1,0.9,0.1,-,6.66
209,Aleksandr Zuev Rubin Kazan,25, D(LR),M(CLR),17,1436,1.4,0.9,1.4,0.2,1.6,0.6,0.1,-,6.66
210,Vladimir Iljin Ural,29, AM(C),FW,11(7),1214,0.6,0.2,1.8,-,0.2,0.6,-,-,6.66
211,Pavel Karasev FC Tambov,29, DMC,,22(5),1945,2.1,1.5,1,-,0.6,0.9,0.3,-,6.66
212,Vitaly Gudiev FK Akhmat,26, GK,,4,360,-,-,-,-,1.5,-,-,-,6.66
213,Bojan Jokic FC Ufa,35, D(CL),M(L),14(1),1282,1.5,1,0.8,0.2,3.1,0.3,0.3,-,6.66
214,Shapi Suleymanov FC Krasnodar,21, AM(R),,12(15),1410,0.4,0.3,0.9,-,0.3,0.3,-,-,6.65
215,Konstantin Pliev Rubin Kazan,25, D(C),,11(1),991,1.5,1.6,0.8,0.6,2.2,0.3,0.8,-,6.65
216,Zuriko Davitashvili Rubin Kazan,20, AM(CLR),,19(7),1684,1,0.3,1.2,-,0.3,0.5,-,-,6.65
217,Grigory Morozov Dinamo Moscow,27, D(CLR),M(R),17(4),1563,1.8,1.3,1.2,0.3,2.2,0.7,0.3,-,6.65
218,Ragnar Sigurdsson FC Rostov,35, D(C),,12(1),1084,1,1.3,0.8,0.7,4.5,0.2,0.5,-,6.64
219,Igor Leshchuk Dinamo Moscow,25, GK,,7(1),706,-,-,-,-,0.6,-,-,-,6.64
220,Edi Gotlieb FC Orenburg,29, D(C),,4(1),272,2.2,0.2,0.4,-,3.8,0.6,0.4,-,6.64
221,Daniil Utkin FC Krasnodar,22, M(C),,12(10),1028,0.5,0.3,0.5,-,0.5,0.2,0.1,-,6.64
222,Nikolay Dimitrov Ural,34, AM(LR),,15(3),1159,1.2,0.6,0.4,-,0.4,0.7,0.1,-,6.64
223,Georgi Zotov FC Orenburg,31, D(LR),M(LR),18(2),1610,2,1.1,1.1,0.2,1.6,0.9,0.1,-,6.64
224,Magomed Musalov FK Akhmat,27, D(LR),,9,773,1.9,1.6,1.2,0.3,2.2,0.6,0.3,-,6.64
225,Andrey Malykh FC Orenburg,33, D(R),M(R),23,2014,1.6,0.8,1.6,-,2.4,1,0.3,1,6.63
226,Kings Kangwa Arsenal Tula,22, DMC,,4(4),435,1.9,1,0.5,-,0.6,0.6,0.1,-,6.63
227,Nikita Belousov FC Ufa,19, Midfielder,,1,90,3,1,-,-,-,-,-,-,6.63
228,Egor Baburin FC Rostov,28, GK,,12,1080,-,-,-,-,0.9,-,-,-,6.63
229,Pavel Mamaev FC Rostov,33, M(CLR),,6(1),543,0.4,0.4,0.6,-,0.1,0.6,0.1,-,6.63
230,Matvey Safonov FC Krasnodar,22, GK,,27,2357,-,-,-,-,0.9,-,-,-,6.63
231,Denis Glushakov FK Akhmat,34, M(C),,22(2),1853,1.4,0.7,1.3,-,1.4,0.8,0.2,-,6.63
232,Danila Prokhin Zenit,20, D(C),,3,270,2,0.3,0.7,0.7,3.3,1,1.3,-,6.63
233,Filip Rogic FC Orenburg,28, AM(CL),,10(1),872,1,0.9,1.5,0.1,1.3,1,0.5,-,6.62
234,Dmitri Zhivoglyadov Lokomotiv Moscow,27, D(CLR),M(R),12(2),1048,1.4,1.2,1.3,0.3,1.6,0.4,0.4,-,6.62
235,Luiz Adriano Spartak Moscow,34, AM(L),FW,3,259,0.3,-,0.7,-,3.3,0.7,-,-,6.62
236,Igor Shkolnik Dinamo Moscow,20, Midfielder,,1(2),162,0.3,-,-,-,-,-,-,-,6.62
237,Oleg Ivanov FK Akhmat,35, M(C),FW,25(2),2214,1.2,0.3,1.2,-,0.8,0.4,0.3,-,6.62
238,Dennis Hadzikadunic FC Rostov,23, D(C),,15(2),1394,1,0.8,1.2,0.5,2.9,0.3,0.5,-,6.61
239,Charles Kaboré Dinamo Moscow,33, M(C),,15(5),1346,2.3,1.2,1.4,-,0.7,1.2,0.4,-,6.61
240,Mikhail Kostyukov FC Tambov,30, M(CLR),FW,25(2),1975,1.3,0.7,1.2,-,0.6,0.4,0.3,-,6.61
241,Gia Grigalava Arsenal Tula,32, D(CL),,22,1980,1,1.1,0.6,0.3,3.9,0.3,0.5,-,6.6
242,Dmitriy Poloz PFC Sochi,30, AM(CLR),FW,14(10),1322,0.2,0.2,0.6,-,0.2,0.5,-,-,6.6
243,Joel Fameyeh FC Orenburg,24, FW,,11(12),1142,0.3,0.2,0.7,-,0.3,0.1,-,-,6.6
244,Aleksandr Rudenko FC Orenburg,28, GK,,3,270,-,-,-,-,2.7,-,-,-,6.6
245,Soslan Takazov FC Tambov,28, D(CL),,15(3),1353,1.8,1,1.3,0.2,3.2,0.6,0.5,-,6.6
246,Azer Aliev FC Ufa,27, D(L),M(L),16(3),1455,0.8,0.8,0.5,0.1,0.7,0.5,0.2,-,6.6
247,Artem Fiedler Ural,38, DMC,,6(1),472,1.1,2,1.9,-,1.6,0.9,0.4,-,6.6
248,Aleksandr Sukhov FC Ufa,35, D(LR),M(LR),28,2440,1.5,0.9,1.3,0.2,1.9,0.8,0.1,-,6.6
249,Roman Romanov FC Rostov,18, Midfielder,,1,46,-,-,-,-,1.0,-,-,-,6.59
250,Nikolay Zolotov Ural,27, D(L),,4(3),423,2.9,2.0,1.3,-,2,0.9,0.6,-,6.59
251,Vadim Afonin FC Orenburg,34, DMC,,5(5),540,1.3,1.1,0.8,0.2,2.1,0.3,0.2,-,6.59
252,Petrus Boumal Ural,28, D(L),DMC,14(2),1181,1.3,1.2,1.9,-,2.2,0.6,0.1,-,6.59
253,Srdjan Mijailovic Krylya Sovetov Samara,28, M(C),,12(3),1044,1.3,1.7,0.9,0.1,1.4,0.3,0.6,-,6.58
254,Arnór Sigurdsson CSKA Moscow,22, AM(CLR),FW,19(3),1427,0.2,0.2,0.7,-,0.1,0.5,-,-,6.58
255,Guus Til Spartak Moscow,23, AM(C),,10(8),1000,1,0.3,1.4,-,0.4,0.4,0.1,-,6.58
256,Yaroslav Godzyur Ural,36, GK,,25,2250,-,0.1,-,-,0.9,-,-,-,6.58
257,Kristijan Bistrovic CSKA Moscow,23, DMC,,15(13),1432,0.7,0.7,0.6,-,0.3,0.6,0.1,-,6.58
258,Vladimir Iljin FK Akhmat,29, AM(C),FW,5(3),498,0.3,0.1,0.5,-,-,0.5,-,-,6.57
259,Roman Emeljanov Ural,29, D(C),M(C),14,1195,1.6,1.4,1,0.7,5.5,0.4,0.6,1,6.57
260,Vadim Milyutin PFC Sochi,19, Defender,,0(1),34,-,1,1,-,1.0,-,-,-,6.57
261,Nikolai Rasskazov Spartak Moscow,23, D(CR),M(R),17(3),1546,1.5,0.9,1.2,0.3,1.0,0.8,0.3,1,6.57
262,Aleksandr Filin FC Tambov,25, D(C),,8(1),725,1,1.8,1,0.4,4.1,0.4,0.6,-,6.57
263,Sergey Pesjakov FC Rostov,32, GK,,17,1530,-,-,-,-,0.4,-,-,1,6.57
264,Vitali Shakhov FC Orenburg,30, D(C),,18,1467,1.9,2,0.9,0.2,3.7,0.6,0.6,-,6.56
265,Mehdi Zeffane Krylya Sovetov Samara,29, D(LR),M(R),6,490,1.5,1.7,0.8,0.2,3.3,1.5,-,-,6.56
266,Anton Kilin FC Tambov,31, D(LR),M(R),22(3),1787,0.9,0.9,0.6,-,1.8,0.3,0.2,-,6.56
267,Aleksey Sutormin Zenit,27, D(R),M(CLR),8(16),987,0.7,0.4,0.6,-,0.1,0.4,0.1,-,6.56
268,Igor Yurganov FC Tambov,27, D(C),,3(4),347,1.6,1.1,0.3,-,3.0,0.1,0.3,-,6.55
269,Timur Ayupov FC Orenburg,28, D(C),DMC,20(2),1826,1.5,1.5,1.6,0.2,2.2,0.6,0.4,1,6.55
270,Lorenzo Melgarejo Spartak Moscow,31, D(L),M(CLR),6(6),621,0.8,0.3,0.5,0.2,1.5,0.3,-,-,6.55
271,Alexander Lomovitskiy Arsenal Tula,23, M(LR),,14(10),1386,0.7,0.4,1.4,-,0.9,0.5,-,-,6.54
272,Nail Umyarov Spartak Moscow,21, DMC,,12(5),1048,2.2,1.5,1.5,0.1,0.6,0.7,0.2,-,6.54
273,Michal Kucharczyk Ural,30, AM(LR),,11(5),916,1,0.5,0.3,-,0.5,0.6,-,-,6.54
274,Giorgi Shelia FC Tambov,32, GK,,29,2610,-,-,-,-,0.3,-,-,-,6.54
275,Daler Kuzyaev Zenit,28, D(R),M(CLR),9(11),756,1.5,0.5,0.8,-,0.4,0.7,0.1,-,6.54
276,Nikolay Komlichenko Dinamo Moscow,26, FW,,7(4),635,-,0.2,1.2,-,0.1,0.1,-,-,6.54
277,Vyacheslav Krotov FC Ufa,28, D(R),M(CLR),15(6),1257,0.4,0.2,1,-,0.9,0.4,-,-,6.54
278,Ezequiel Ponce Spartak Moscow,24, AM(L),FW,18(9),1666,0.1,0.1,1.3,-,0.6,0.2,0.1,-,6.54
279,Konstantin Kuchaev CSKA Moscow,23, M(CLR),,14(11),1416,1.6,0.7,0.6,-,0.8,0.6,-,-,6.54
280,Zoran Nizic FK Akhmat,32, D(C),,18(3),1637,0.7,1.4,1.0,0.7,3.9,0.4,0.6,-,6.53
281,Saveli Kozlov FC Orenburg,24, D(C),,5(4),532,1.4,1.1,0.9,0.1,3.4,1.1,0.8,-,6.53
282,Ayaz Guliev Spartak Moscow,24, M(C),,8(3),645,1.5,0.9,1.1,-,0.7,0.7,0.2,-,6.53
283,Danil Stepanov Rubin Kazan,21, D(L),M(L),7(2),677,2.1,1.0,1.2,0.1,1.0,1.1,0.3,-,6.53
284,Aleksandr Denisov Arsenal Tula,32, D(C),,12(1),954,1.2,1.3,1.5,0.4,4.5,0.6,0.5,-,6.53
285,Vladimir Poluyakhtov Krylya Sovetov Samara,32, D(LR),,11(1),1001,2.2,1.9,1.9,0.2,1.6,1.1,0.2,1,6.53
286,Miguel Cardoso Dinamo Moscow,27, AM(CLR),FW,3(3),273,1.0,0.2,0.7,-,0.3,1,-,-,6.53
287,Artem Sokol Arsenal Tula,24, D(C),,1(2),123,0.3,0.7,1.0,-,2.7,-,-,-,6.52
288,Olivier Thill FC Ufa,24, AM(CR),,17(5),1375,0.9,0.3,0.9,-,0.5,0.6,-,-,6.52
289,Pavel Alikin FC Ufa,37, D(CL),,7(2),651,0.7,0.6,0.7,0.2,5.4,0.6,0.9,-,6.52
290,Andrés Ponce FK Akhmat,25, FW,,14(6),1111,0.3,0.3,1.7,-,0.3,0.2,0.1,-,6.52
291,Nikolay Poyarkov Rubin Kazan,22, D(L),,6(1),540,2.3,1.6,1.0,0.1,0.9,0.7,0.3,-,6.51
292,Aleksandr Erokhin Zenit,32, M(CLR),FW,9(14),850,0.6,0.4,0.8,-,0.4,0.3,0.2,-,6.51
293,Dmitri Kabutov Krylya Sovetov Samara,29, M(R),,24(4),1946,1.1,0.7,1.6,0.1,0.8,0.8,0.1,-,6.51
294,Yuri Bavin Ural,27, M(C),,8(13),876,1.0,0.7,0.9,-,0.4,0.6,0.2,-,6.51
295,Pavel Mogilevets Rubin Kazan,28, DMC,,16(4),1355,0.8,0.5,0.5,0.1,0.6,0.8,0.3,-,6.51
296,Andrey Eshchenko Spartak Moscow,37, D(LR),M(R),8(6),683,1.5,0.9,1.1,0.1,1.1,1.0,0.5,-,6.51
297,Nikita Malyarov FC Orenburg,32, M(C),,3,195,1.0,0.3,2.3,-,1.3,0.3,-,-,6.5
298,Vyacheslav Podberezkin Rubin Kazan,29, M(CLR),,19(2),1537,1.3,0.7,1.2,-,0.5,1.1,-,-,6.5
299,Soltmurad Bakaev Rubin Kazan,22, AM(LR),,3(7),326,1.0,0.7,0.9,-,0.1,0.5,0.1,-,6.5
300,Arsen Adamov FK Akhmat,22, D(CLR),,1,90,2,6,3,-,-,1.0,1,-,6.5
301,Kirill Nababkin CSKA Moscow,35, D(CLR),M(LR),9(4),832,1.2,0.8,1.2,0.2,1.2,0.1,0.5,-,6.49
302,Danijel Miskic FC Orenburg,28, M(C),,22,1929,1.5,0.9,1.1,-,1.3,1.0,0.2,-,6.49
303,Younes Namli FC Krasnodar,27, M(CLR),,6(4),439,0.8,0.5,0.8,-,0.2,0.3,0.2,-,6.49
304,Evgeni Gorodov FK Akhmat,35, GK,,25,2250,-,-,-,-,0.9,0.1,-,-,6.49
305,Kirill Panchenko Dinamo Moscow,32, AM(CL),FW,12(10),1066,0.5,0.4,0.2,-,0.1,0.6,-,-,6.48
306,Artem Shabolin Ural,21, Midfielder,,0(1),23,2,2,-,-,-,2.0,-,-,6.48
